### ISSUE TITLE
DNS Server

### ISSUE THREAD

**Issue by MarinoMtz** [AdguardTeam/dnsproxy#188]
Hi, 

I'm trying to configure a DNS Server using the dnsproxy as forwarder for the dns-queries. The configuration i have is the following:

Client : dnsproxy as a DoH client 
Server : dnsproxy as a forwarder : the idea is that it takes the DNS query from the HTTP and then replies with the corresponding DNS response by using the desired upstream, for the certificates validation I use NGINX with let's encrypt certs.

I have the following configuration:

Client:
```
verbose: true
output: /home/ivan/client.txt
listen-addrs:
  - 127.0.0.3
listen-ports:
  - 53
tls-min-version: 1.3
upstream:
  - "https://dohauth.iot-roam.net/dns-query"
bootstrap:
  - '8.8.8.8:53'
cache-size: 64000
ratelimit: 0
ipv6-disabled: false
udp-buf-size: 0
max-go-routines: 0
version: false
```
Server:
```
---
bootstrap:
  - "8.8.8.8:53"
listen-addrs:
  - "127.0.0.1"
listen-ports:
  - 53
  - 8053
max-go-routines: 0
ratelimit: 0
udp-buf-size: 0
upstream:
  - "8.8.8.8:53"
https-port:
  - 443
verbose: true
output: "/home/ivan/server.txt"
```
Then, if I run tshark I can actually see the DNS query arriving:
```
Running as user "root" and group "root". This could be dangerous.
Capturing on 'Loopback: lo'
    1 0.000000000    127.0.0.1 → 127.0.0.1    TCP 74 32902 → 8053 [SYN] Seq=0 Win=65495 Len=0 MSS=65495 SACK_PERM=1 TSval=1702772584 TSecr=0 WS=128
    2 0.000015800    127.0.0.1 → 127.0.0.1    TCP 74 8053 → 32902 [SYN, ACK] Seq=0 Ack=1 Win=65483 Len=0 MSS=65495 SACK_PERM=1 TSval=1702772584 TSecr=1702772584 WS=128
    3 0.000031916    127.0.0.1 → 127.0.0.1    TCP 66 32902 → 8053 [ACK] Seq=1 Ack=1 Win=65536 Len=0 TSval=1702772584 TSecr=1702772584
    4 0.000443476    127.0.0.1 → 127.0.0.1    HTTP 387 GET /dns-query?dns=l0YBIAABAAAAAAABBmdvb2dsZQNjb20AAAEAAQAAKRAAAAAAAAAMAAoACFlUCwOWR0Cg HTTP/1.1 
```
But there is no successful DNS resolution

I attached both, the server and client side traces

[client.txt](https://github.com/AdguardTeam/dnsproxy/files/7547762/client.txt)
[server.txt](https://github.com/AdguardTeam/dnsproxy/files/7547826/server.txt)

Maybe I'm misunderstanding something?
Thanks for your help !

**Comment by ameshkov** [comment]
Could it be that misconfiguration is on the nginx side? Have you tried using curl and requesting the plain HTTP URL first?

Also, why listening on 443 for plain HTTP?

**Comment by MarinoMtz** [comment]
Hi,

I have tried using curl as you suggest, but I get this : 

```
ivan@ivan:~$ curl -i --http2 https://dohauth.iot-roam.net:443/dns-query
HTTP/2 502 
server: nginx/1.20.1
date: Wed, 17 Nov 2021 09:24:50 GMT
content-type: text/html
content-length: 157
strict-transport-security: max-age=31536000; includeSubDomains

<html>
<head><title>502 Bad Gateway</title></head>
<body>
<center><h1>502 Bad Gateway</h1></center>
<hr><center>nginx/1.20.1</center>
</body>
</html>
```

Then, if I stop the dns proxy and start another doh server (the one I want to replace with dnsproxy [m12353](https://github.com/m13253/dns-over-https) that is actually working now:

```
ivan@ivan:~$ curl -i --http2 https://dohauth.iot-roam.net:443/dns-query
HTTP/2 415 
server: nginx/1.20.1
date: Wed, 17 Nov 2021 09:21:36 GMT
content-type: application/json; charset=UTF-8
content-length: 62
access-control-allow-headers: Content-Type
access-control-allow-methods: GET, HEAD, OPTIONS, POST
access-control-allow-origin: *
access-control-max-age: 3600
x-powered-by: DNS-over-HTTPS/2.3.1 (+https://github.com/m13253/dns-over-https)
strict-transport-security: max-age=31536000; includeSubDomains
```
I attached the nginx configs

Thanks for your help.

Ivan Marino.

[dns-over-https.txt](https://github.com/AdguardTeam/dnsproxy/files/7553502/dns-over-https.txt)

**Comment by ameshkov** [comment]
Note that dnspoxy wouldn't run a DoH server without TLSConfig:
https://github.com/AdguardTeam/dnsproxy/blob/499a996df4ae8ccd6f2991dd61e5d706af7fce6d/main.go#L438

Probably, we'll need a separate command-line option to allow that.

**Comment by MarinoMtz** [comment]
Oh I see now, we need to actually pass the certs to do it.

I'll look at that.

Thx

**Comment by ameshkov** [comment]
Well, in this case you probably won't need nginx to do TLS termination for you.

Your config only makes sense if dnsproxy listens to plain HTTP.

**Comment by MarinoMtz** [comment]
Yes, I see your point, but since I'll validate later client-side certificates, I prefer to have nginx to validate it, btw, I've changed the code for client certs, I'll try to make the tests when I have some time.

**Comment by rampageX** [comment]
dnsproxy:

`dnsproxy -l 127.0.0.1 -p 0 -s 8053 -u 8.8.8.8 -u 1.1.1.1 -f 9.9.9.11 --edns --all-servers --cache --cache-size=10485760 --cache-optimistic -c fullchain.cer -k your.key`

nginx：

```
         location /dns-query {
                proxy_pass       https://127.0.0.1:8053/dns-query;
                proxy_set_header Host      $host;
                proxy_set_header X-Real-IP $remote_addr;
        }
```

Short answer: load certs&key on both `dnsproxy` and `nginx`, then change `proxy_pass http://` to `proxy_pass https://`, is woking.

**Comment by MarinoMtz** [comment]
Thanks for  your help @rampageX it worked perfectly !!

**Comment by ameshkov** [comment]
Well, what I meant is that currently it's double work (you do TLS encryption on both nginx and dnsproxy). Ideally, we should expose an option to work as a plain HTTP server and there's a technical possibility, it is just not exposed via command-line API.

**Comment by Glide01** [comment]
> Well, what I meant is that currently it's double work (you do TLS encryption on both nginx and dnsproxy). Ideally, we should expose an option to work as a plain HTTP server and there's a technical possibility, it is just not exposed via command-line API.

Really need this feature

**Comment by the-vindicar** [comment]
This feature is needed, because nginx allows for a smoother workflow when updating certificates. 

Specifically, if you dockerize both `certbot` and `dnsproxy`, you will still need to configure a cronjob on the host machine to restart `dnsproxy` every now and then - or else you will need to expose docker socket into `certbot` container, which is a whole different can of worms.

Where as if you terminate TLS on nginx, you can just do `nginx -s reload` inside nginx container every now and then, nice and easy.

**Comment by unreal79** [comment]
My command: `/usr/local/bin/dnsproxy -l 127.0.0.1 --doh-insecure-enabled --cache -u 8.8.8.8 -u 1.1.1.1 -f 9.9.9.11 -s 8053 -p 0 -v`

Looks like parameter `-p 0` is ignored in my  version v0.84.1. UDP and TCP are still listened with some random port, but DOH does not:
```
2026/08/26 14:58:57.397195 DEBUG hosts files are enabled
2026/08/26 14:58:57.397239 DEBUG hosts files are not specified, using default paths=[/etc/hosts]
2026/08/26 14:58:57.397661 DEBUG set upstream idx=0 addr=8.8.8.8:53
2026/08/26 14:58:57.398585 DEBUG set upstream idx=1 addr=1.1.1.1:53
2026/08/26 14:58:57.398975 DEBUG set upstream idx=0 addr=9.9.9.11:53
2026/08/26 14:58:57.399130 INFO upstream mode is set prefix=dnsproxy mode=load_balance
2026/08/26 14:58:57.399545 INFO cache enabled prefix=dnsproxy size=65536
2026/08/26 14:58:57.399755 INFO starting dns proxy server prefix=dnsproxy
2026/08/26 14:58:57.400027 INFO creating udp server socket prefix=dnsproxy addr=127.0.0.1:0
2026/08/26 14:58:57.400237 INFO listening to udp prefix=dnsproxy addr=127.0.0.1:56572
2026/08/26 14:58:57.401073 INFO creating tcp server socket prefix=dnsproxy addr=127.0.0.1:0
2026/08/26 14:58:57.402855 INFO listening to tcp prefix=dnsproxy addr=127.0.0.1:36033
2026/08/26 14:58:57.403981 INFO entering udp listener loop prefix=dnsproxy addr=127.0.0.1:56572
2026/08/26 14:58:57.404666 INFO entering listener loop prefix=dnsproxy proto=tcp addr=127.0.0.1:36033

```
